{
 "assets": [
  {
   "bytes": 3369066,
   "path": "citation_tasks/citation-tasks.v2.jsonl",
   "records": 500,
   "sha256": "528cd34d4f2cac552a4dd6abf002aab34df68f5c0a606c0046751aeca9b0b20d"
  },
  {
   "bytes": 416226,
   "distribution": "evaluator-only; never published",
   "path": "citation_tasks/citation-task-oracle.v2.jsonl",
   "records": 500,
   "sha256": "322713d08bfb5c97919f4da249b5d0ae73e0eaec920fa08833cecd0d8b7b1b68"
  }
 ],
 "classification": "CLEANROOM_SYNTHETIC",
 "coverage": {
  "categories": {
   "polarity_adversary": 80,
   "qualifier_adversary": 80,
   "relation_adversary": 80,
   "supported_claim": 100,
   "unsupported_addition_guard": 80,
   "unsupported_refusal": 80
  },
  "expected_answer_kinds": {
   "answer": 180,
   "refusal": 320
  },
  "scenario_families": {
   "sealed_booking_allocations": 63,
   "sealed_collateral_margin": 62,
   "sealed_evidence_sufficiency": 63,
   "sealed_lifecycle": 62,
   "sealed_permissions_release": 63,
   "sealed_reconciliation": 62,
   "sealed_settlement_exceptions": 63,
   "sealed_temporal_causality": 62
  }
 },
 "episode_count": 40,
 "schema": "cleanroom.citation-task-set/v2",
 "set_id": "cmo_cleanroom_citation_tasks_v1",
 "source_sealed_set": {
  "manifest_path": "cleanroom_eval/assets/sealed-set.manifest.v1.json",
  "manifest_sha256": "89334bee72e7cfa0966b472a13d0ff65eda20d6693633473d55ee55d0f939b15",
  "set_id": "cmo_cleanroom_sealed_v1"
 },
 "status": "FROZEN",
 "supersession": {
  "reason": "v1 task ids and ledger disclosed per-task category and expected answer kind, making the answer-vs-refusal gold publicly recoverable; v2 ids are salted hashes and the ledger carries hashes and episode linkage only. Aggregate coverage counts are retained deliberately.",
  "resealed_at": "2026-08-29T04:02:36+00:00",
  "superseded_manifest_sha256": "ae162bb9ec60c2234e0000ea8e5d9f328f0f4f48adb46dac589a5f63a1cbb80e",
  "supersedes": "citation-tasks.manifest.v1.json"
 },
 "task_count": 500,
 "task_ledger": [
  {
   "episode_id": "episode_reconciliation_delta_v1",
   "oracle_sha256": "8e2d95400d0ff2bf0d47d5f9dfc3cd3df2b52f6a59425ade29f78761135940d8",
   "sequence": 1,
   "task_id": "ct_00f6e19d1e7eb69c",
   "task_sha256": "e4f96e596240164e6af42832c2487b97f0ec03d3d80f1c4dc03bd25bc7831da2"
  },
  {
   "episode_id": "episode_lifecycle_alpha_v1",
   "oracle_sha256": "c2e1d67b6b86b3fe9f68137ce9bb7ee0f61ea2c383ece81ab0d55c56e8c9c49a",
   "sequence": 2,
   "task_id": "ct_01041625f1e86b17",
   "task_sha256": "d2be965668801425d867ac4acf5dbbd32515190dc2fb58d329e3ec7827f0374e"
  },
  {
   "episode_id": "episode_temporal_causality_alpha_v1",
   "oracle_sha256": "831868f7f1f1b4922cf4077588cd2f8fc113fcc5243d091b726fc1737ca84521",
   "sequence": 3,
   "task_id": "ct_01927b6b7437719a",
   "task_sha256": "e3ede7757a50b8a8f016d84fbc1b85d9b18273ecb522617470fa82cd9416fefb"
  },
  {
   "episode_id": "episode_permissions_release_bravo_v1",
   "oracle_sha256": "91253416850f9112925667e0abeb5f73a32bef442f5c53e3f4132d6e1b27c643",
   "sequence": 4,
   "task_id": "ct_01968427f33d571a",
   "task_sha256": "79159e3f5135f3ca4f7e276306f61286ea59677da03badf90b4a8a40daee01da"
  },
  {
   "episode_id": "episode_settlement_exceptions_alpha_v1",
   "oracle_sha256": "e59827dec0dfd873f31351ba6101b07ce993ea67d8b28ce2f0819769c8d6ab8d",
   "sequence": 5,
   "task_id": "ct_01a7bf771e2c217c",
   "task_sha256": "4b50949c47c6121c3b4ed1f7d32c3098667aa29316f66f9c5eb7ec1172df22b5"
  },
  {
   "episode_id": "episode_temporal_causality_delta_v1",
   "oracle_sha256": "8569030a76a72d21c65e421facb8ce4700385bf2980e4d2672e3c4c42f9a4f4c",
   "sequence": 6,
   "task_id": "ct_01bb8cba7c3defa4",
   "task_sha256": "67f6878b6f4c6fdb812a09a988600621e08a129c6010c6f301d73337274e7c1c"
  },
  {
   "episode_id": "episode_lifecycle_echo_v1",
   "oracle_sha256": "511449b929a9adffbfa0ab86ec17cdbac41e5c03fd421f519bda4f3d09f875e9",
   "sequence": 7,
   "task_id": "ct_03209a9f256d6589",
   "task_sha256": "5745d7308cac31864963dd9160dfe953e69b96c71ec3942493b2dcab6794f115"
  },
  {
   "episode_id": "episode_evidence_sufficiency_alpha_v1",
   "oracle_sha256": "d3d91a09b4969c9dd1fccbeaf25d9151e43aa42f158efd1487202f9f5d17f81c",
   "sequence": 8,
   "task_id": "ct_037ccaf59d4f7d3a",
   "task_sha256": "ab8cc25dc20c2c7c964a9ea45a6e804d11a814c67f892be4261b06ba79bf599f"
  },
  {
   "episode_id": "episode_booking_allocations_echo_v1",
   "oracle_sha256": "0f6cd8c4788d5cc36a767f639045e55d9b4210ebe44687630574cc9def6676eb",
   "sequence": 9,
   "task_id": "ct_038300355cf14052",
   "task_sha256": "41b64fd67e266084accf5badcf41625ab15f739d5b582557b5244158c4c76a6f"
  },
  {
   "episode_id": "episode_lifecycle_delta_v1",
   "oracle_sha256": "d8f62e8142d59224a4590376f44ed6fcc487c7654cf31a9d41adc88646fbea8b",
   "sequence": 10,
   "task_id": "ct_03dfaa8f8ec0b6b8",
   "task_sha256": "7f58e4b7e568f5803fc0f15dcc96c6105a1f2d9b93f1d050fedf30b7089266af"
  },
  {
   "episode_id": "episode_booking_allocations_charlie_v1",
   "oracle_sha256": "89aba06b610d57e1fddb2bbaf8dcba04440f5a2e286d1e33324739a13fe19c03",
   "sequence": 11,
   "task_id": "ct_03f670f9891d9254",
   "task_sha256": "5e050854c56d745a831efecbd5da43ea4558e4117bd9b1868d182f40f471d5fe"
  },
  {
   "episode_id": "episode_reconciliation_delta_v1",
   "oracle_sha256": "2568f34726758933a53dba41f48200ff9153c0e9eb3610c5ff6af460d1084fbe",
   "sequence": 12,
   "task_id": "ct_0413d1acafaa76a5",
   "task_sha256": "a94bf03fcc8ed1dffc8fe78e492942c5fddc0db59ce970ad6532bb38c9cb6231"
  },
  {
   "episode_id": "episode_settlement_exceptions_delta_v1",
   "oracle_sha256": "487f78aea80d9a5dbeb3e157fee084b17f7dd9d2a2fa7fb254d47e780aa7383e",
   "sequence": 13,
   "task_id": "ct_061678a34121bca1",
   "task_sha256": "75581e461aa057dabd46ff196a8857814b208a38b837cbc021dceed746284e1d"
  },
  {
   "episode_id": "episode_booking_allocations_charlie_v1",
   "oracle_sha256": "71ba26d078c8dba70ac963c6b7bcc8e4240ebcf43988399bab63188a6e22426d",
   "sequence": 14,
   "task_id": "ct_0635bd3f1448e018",
   "task_sha256": "8203c855a7c4a8685e1a34d28c8bf176390a63ccfd6456b43e70b3e6d126bf77"
  },
  {
   "episode_id": "episode_permissions_release_charlie_v1",
   "oracle_sha256": "195b10d5907b72096f468f1e8a3fecd9c226d92d88c56d90473c58facbf97ec2",
   "sequence": 15,
   "task_id": "ct_0812e694a0779719",
   "task_sha256": "15e2ce5691e8f86483a5feb45d70a5a9733c8a7ae3d85ff55751fafaa4fb0a3e"
  },
  {
   "episode_id": "episode_settlement_exceptions_echo_v1",
   "oracle_sha256": "c75ecd5f29409019d323acfcd1614d6c0d9f35801f79fd2291286a748f6503c4",
   "sequence": 16,
   "task_id": "ct_082fe66773bf9b69",
   "task_sha256": "91fa372535bc0085ba26ab717fd5ee9dd5b46483822bea19c87a9dbcafeebeb0"
  },
  {
   "episode_id": "episode_collateral_margin_delta_v1",
   "oracle_sha256": "1c4bafdcc3a5d25f92a2407b09260d337e1c66bb32e00ff63ed8241ae56b5b80",
   "sequence": 17,
   "task_id": "ct_08715f17b940e3c8",
   "task_sha256": "da72224579d59a32a85759c86e9d12e8653425d8f232641904a174a76efbd404"
  },
  {
   "episode_id": "episode_lifecycle_echo_v1",
   "oracle_sha256": "93a4a7c88eda5600c19c79004ec3ca15959da2839372507444e4aac1a3cb6023",
   "sequence": 18,
   "task_id": "ct_08ca7fb6ec8fadee",
   "task_sha256": "27187a1fc62198a1c5e2fa1ae17d39a27d009ac556343450709a19c5dfc9fbbf"
  },
  {
   "episode_id": "episode_collateral_margin_delta_v1",
   "oracle_sha256": "add805c536ba4a88cb9c52e2312e3e35697f675cf03a9cc3adacef0b4d847eb9",
   "sequence": 19,
   "task_id": "ct_08dcf52d76fbe50b",
   "task_sha256": "bc4e020a3ed4804a1f3a61ff4a42b7c3c463409ea16c155f6f20af752a22cd84"
  },
  {
   "episode_id": "episode_lifecycle_bravo_v1",
   "oracle_sha256": "645a5dd63dda28fe31a3c2a623f56e56d02a1087f3d9e78d9ba089bc323d1e77",
   "sequence": 20,
   "task_id": "ct_08ea8a1b58c0f3c2",
   "task_sha256": "44e05811ade61239e1416797803d4c79f6cc66c81a26836044c26879ba1e33ef"
  },
  {
   "episode_id": "episode_reconciliation_charlie_v1",
   "oracle_sha256": "7b2c63b9b1a00e646cbb32a5d96af4be82c837b50d6b7a94b073aea50cb717da",
   "sequence": 21,
   "task_id": "ct_09b85c2131cfbe83",
   "task_sha256": "8296389f92291eacd44b2924b5bcbead0a01b5bcae1e272fe3bd123a016a0332"
  },
  {
   "episode_id": "episode_settlement_exceptions_delta_v1",
   "oracle_sha256": "01335d64ae9f68a4291662a389913337f16c58bc12211363e72b4f38852554ba",
   "sequence": 22,
   "task_id": "ct_0abe4ffddf10a65b",
   "task_sha256": "643a3581f5a4b63d07d764828bb38e01e2a71380fce667a5ff5291a53b50df86"
  },
  {
   "episode_id": "episode_permissions_release_charlie_v1",
   "oracle_sha256": "7db104a82f9da74ee33ff06798a764688578f921651836fa19288d27b9b5ad92",
   "sequence": 23,
   "task_id": "ct_0af1856dd9848ccf",
   "task_sha256": "67fac0fe9c91dc80a642c79bfc5c9a3e1260c9af3174fae134942109c14ab16d"
  },
  {
   "episode_id": "episode_lifecycle_alpha_v1",
   "oracle_sha256": "66190f6c958c965ca4843b654e08fb626cdc2120d49c7d50996f3353def5d931",
   "sequence": 24,
   "task_id": "ct_0bf9c0e3a259ace1",
   "task_sha256": "eacaec49df5989e680f504708c3e7ba54911c2bdfc52d1079bde62104ab15945"
  },
  {
   "episode_id": "episode_temporal_causality_charlie_v1",
   "oracle_sha256": "5fef5b64b5f7bffec136e1200f56eb43729144e92d2439286a418e053b93ce91",
   "sequence": 25,
   "task_id": "ct_0c12eb0ba5779ece",
   "task_sha256": "432d7aed11490571c402fc9dfaedd2fcc63a77ebb794b1c7f1f269ce4defaa98"
  },
  {
   "episode_id": "episode_temporal_causality_echo_v1",
   "oracle_sha256": "566731de684d071ba5c440ba00c56b5613f2d44181a93c416b79288f2a33e2d8",
   "sequence": 26,
   "task_id": "ct_0d2ba56e0b09af93",
   "task_sha256": "dd36301c11ff559e5396b6a5a4aeaedeec4cc35d6e51d6c72deb357363683457"
  },
  {
   "episode_id": "episode_temporal_causality_echo_v1",
   "oracle_sha256": "0ed77cecdc23a32e0354a328f8d84fb8cc3d6e1c27b9c2188dd4eb6cdf121cbf",
   "sequence": 27,
   "task_id": "ct_0eba1e9fc2631d3f",
   "task_sha256": "e497e957ca921ebae9caa03607c28a5f745e41623f58e33013645c690a71a41a"
  },
  {
   "episode_id": "episode_booking_allocations_echo_v1",